{"schema_version":"1","analysis_rev":"fx-0001","producer_commit":"w0-fixture","input_artifact_hashes":{},"events":[{"id":"E1","type":"near_miss","t0_ms":4300,"t1_ms":5900,"actor_ids":["P1","F1"],"place_id":null,"severity":2,"source":"rule","params":{"min_dist_m":1.4094,"t_min_ms":4900,"threshold_m":2.0},"clip_ids":["wh-sdg-fixture-01:ceiling_00:00000","wh-sdg-fixture-01:ceiling_04:00000","wh-sdg-fixture-01:eye_00:00000"],"eids":[]},{"id":"E2","type":"dodge","t0_ms":4600,"t1_ms":5600,"actor_ids":["P1"],"place_id":null,"severity":1,"source":"gt","params":{"label":"Dodge"},"clip_ids":["wh-sdg-fixture-01:ceiling_00:00000","wh-sdg-fixture-01:ceiling_04:00000","wh-sdg-fixture-01:eye_00:00000"],"eids":[]}]}
