{"schema_version":"1","analysis_rev":"fx-0001","producer_commit":"w0-fixture","input_artifact_hashes":{},"events":[{"id":"E1","type":"ped_crossing","t0_ms":3000,"t1_ms":8000,"actor_ids":["P1"],"place_id":"pl_queen_spadina","severity":2,"source":"rule","params":{"min_dist_m":6.6571,"near_t0_ms":5800},"clip_ids":["fl-pie-fixture-01:dashcam:00000","fl-pie-fixture-01:dashcam:00001"],"eids":[]},{"id":"E2","type":"hard_brake","t0_ms":5000,"t1_ms":6500,"actor_ids":[],"place_id":"pl_queen_spadina","severity":1,"source":"rule","params":{"decel_mps2":-4.0},"clip_ids":["fl-pie-fixture-01:dashcam:00001"],"eids":[]}]}
